{
 "bundle_version": "1.0",
 "run_id": "phase0-pi-185-1-rep_900-20260819T054713+0000",
 "harness": "pi",
 "sample_id": "185-1",
 "exported_at": "2026-08-19T06:10:27+00:00",
 "source_commit": "f23a961a47990c1fd471b36e2134bf6cf3364ea2",
 "task": {
  "question": "Which activity is the most likely one for the two main people in the image?",
  "options": [
   "A. Having a conversation.",
   "B. Dancing.",
   "C. Arguing.",
   "D. Playing a game."
  ],
  "option_rotation": 0,
  "duration_label": "short",
  "has_gold": false
 },
 "video": {
  "id": "mmKggCnGtA4",
  "duration_sec": 120.419,
  "fps": 23.976,
  "width": 640,
  "height": 272,
  "nb_frames": 2885,
  "proxy": "video/mmKggCnGtA4.480p.mp4"
 },
 "budget": {
  "limits": {
   "coarse_frames": 16,
   "dense_frames": 16,
   "vlm_inspected_frames": 32
  },
  "final": {
   "coarse_frames": 16,
   "dense_frames": 0,
   "vlm_inspected_frames": 0
  },
  "ledger": [
   {
    "category": "coarse_frames",
    "n": 16,
    "tool": "crv_prepare",
    "granted": true,
    "used_before": 0,
    "limit": 16,
    "detail": null
   },
   {
    "category": "vlm_inspected_frames",
    "n": 8,
    "tool": "vlm_inspect",
    "granted": true,
    "used_before": 0,
    "limit": 32,
    "detail": null
   }
  ]
 },
 "frames": [
  {
   "id": "frame_001",
   "t": 0.0,
   "file": "frames/frame_001.jpg",
   "selection_reason": "first",
   "pass": "coarse",
   "inspected": true,
   "cited": false,
   "observation": null
  },
  {
   "id": "frame_002",
   "t": 7.007,
   "file": "frames/frame_002.jpg",
   "selection_reason": "global",
   "pass": "coarse",
   "inspected": false,
   "cited": false,
   "observation": null
  },
  {
   "id": "frame_003",
   "t": 15.015,
   "file": "frames/frame_003.jpg",
   "selection_reason": "action",
   "pass": "coarse",
   "inspected": true,
   "cited": true,
   "observation": null
  },
  {
   "id": "frame_004",
   "t": 22.022,
   "file": "frames/frame_004.jpg",
   "selection_reason": "action",
   "pass": "coarse",
   "inspected": false,
   "cited": false,
   "observation": null
  },
  {
   "id": "frame_005",
   "t": 30.03,
   "file": "frames/frame_005.jpg",
   "selection_reason": "action",
   "pass": "coarse",
   "inspected": true,
   "cited": true,
   "observation": null
  },
  {
   "id": "frame_006",
   "t": 38.038,
   "file": "frames/frame_006.jpg",
   "selection_reason": "action",
   "pass": "coarse",
   "inspected": false,
   "cited": false,
   "observation": null
  },
  {
   "id": "frame_007",
   "t": 44.044,
   "file": "frames/frame_007.jpg",
   "selection_reason": "global",
   "pass": "coarse",
   "inspected": true,
   "cited": true,
   "observation": null
  },
  {
   "id": "frame_008",
   "t": 52.052,
   "file": "frames/frame_008.jpg",
   "selection_reason": "global",
   "pass": "coarse",
   "inspected": false,
   "cited": false,
   "observation": null
  },
  {
   "id": "frame_009",
   "t": 60.06,
   "file": "frames/frame_009.jpg",
   "selection_reason": "global",
   "pass": "coarse",
   "inspected": true,
   "cited": false,
   "observation": null
  },
  {
   "id": "frame_010",
   "t": 67.067,
   "file": "frames/frame_010.jpg",
   "selection_reason": "global",
   "pass": "coarse",
   "inspected": false,
   "cited": false,
   "observation": null
  },
  {
   "id": "frame_011",
   "t": 75.075,
   "file": "frames/frame_011.jpg",
   "selection_reason": "global",
   "pass": "coarse",
   "inspected": true,
   "cited": false,
   "observation": null
  },
  {
   "id": "frame_012",
   "t": 82.082,
   "file": "frames/frame_012.jpg",
   "selection_reason": "global",
   "pass": "coarse",
   "inspected": false,
   "cited": false,
   "observation": null
  },
  {
   "id": "frame_013",
   "t": 89.089,
   "file": "frames/frame_013.jpg",
   "selection_reason": "global",
   "pass": "coarse",
   "inspected": true,
   "cited": false,
   "observation": null
  },
  {
   "id": "frame_014",
   "t": 97.097,
   "file": "frames/frame_014.jpg",
   "selection_reason": "global",
   "pass": "coarse",
   "inspected": false,
   "cited": false,
   "observation": null
  },
  {
   "id": "frame_015",
   "t": 104.104,
   "file": "frames/frame_015.jpg",
   "selection_reason": "global",
   "pass": "coarse",
   "inspected": true,
   "cited": false,
   "observation": null
  },
  {
   "id": "frame_016",
   "t": 112.112,
   "file": "frames/frame_016.jpg",
   "selection_reason": "global",
   "pass": "coarse",
   "inspected": false,
   "cited": false,
   "observation": null
  }
 ],
 "events": [
  {
   "t": 0.0,
   "type": "run.start"
  },
  {
   "t": 0.0,
   "type": "step.begin"
  },
  {
   "t": 0.0,
   "type": "agent.say",
   "text": "I'll work through this systematically, following the rules and using the provided tools to analyze the video and answer the question.\n\nFirst, let me check what video we're working with by examining the task file:"
  },
  {
   "t": 0.0,
   "type": "tool.call",
   "tool": "read",
   "args": {
    "path": "input/task.json"
   }
  },
  {
   "t": 0.008,
   "type": "tool.result",
   "tool": "read",
   "ok": true,
   "detail": "{\n  \"sample_id\": \"185-1\",\n  \"video_path\": \"data/working/videos/mmKggCnGtA4.mp4\",\n  \"question\": \"Which activity is the most likely one for the two main people in the image?\",\n  \"options\": [\n    \"A. Having a conversation.\",\n    \"B. Dancing.\",\n    \"C. Arguing.\",\n    \"D. Playing a game.\"\n  ],\n  \"duration\": \"short\",\n  \"role\": \"expansion\"\n}"
  },
  {
   "t": 0.641,
   "type": "step.begin"
  },
  {
   "t": 0.641,
   "type": "agent.say",
   "text": "Now I'll probe the video to understand its duration:"
  },
  {
   "t": 0.641,
   "type": "tool.call",
   "tool": "bash",
   "script": "probe_video",
   "args": {
    "command": "python tools/probe_video.py --video data/working/videos/mmKggCnGtA4.mp4"
   }
  },
  {
   "t": 0.723,
   "type": "tool.error",
   "tool": "bash",
   "script": "probe_video",
   "detail": "{\"error\": \"DATA_DECODE\", \"message\": \"video not found: data/working/videos/mmKggCnGtA4.mp4\"}\n\n\nCommand exited with code 2"
  },
  {
   "t": 0.723,
   "type": "tool.result",
   "tool": "bash",
   "script": "probe_video",
   "ok": false,
   "detail": "{\"error\": \"DATA_DECODE\", \"message\": \"video not found: data/working/videos/mmKggCnGtA4.mp4\"}\n\n\nCommand exited with code 2"
  },
  {
   "t": 1.37,
   "type": "step.begin"
  },
  {
   "t": 1.37,
   "type": "agent.say",
   "text": "Let me check what video files are actually available:"
  },
  {
   "t": 1.37,
   "type": "tool.call",
   "tool": "bash",
   "args": {
    "command": "find /home/video-code-harness/video-agent-harness-phase0/data -name \"*.mp4\" | head -10"
   }
  },
  {
   "t": 1.393,
   "type": "tool.result",
   "tool": "bash",
   "ok": true,
   "detail": "find: ‘/home/video-code-harness/video-agent-harness-phase0/data/labels’: Permission denied\nfind: ‘/home/video-code-harness/video-agent-harness-phase0/data/raw’: Permission denied\n/home/video-code-harness/video-agent-harness-phase0/data/working/videos/mD_7mhnPS_Y.mp4\n/home/video-code-harness/video-agent-harness-phase0/data/working/videos/MiPw-RZMHCQ.mp4\n/home/video-code-harness/video-agent-harness-phase0/data/working/videos/Kv1JXuOkAfk.mp4\n/home/video-code-harness/video-agent-harness-phase0/data/working/videos/mmKggCnGtA4.mp4\n/home/video-code-harness/video-agent-harness-phase0/data/working/videos/lokFoo_QD8c.mp4"
  },
  {
   "t": 2.204,
   "type": "step.begin"
  },
  {
   "t": 2.204,
   "type": "agent.say",
   "text": "The file exists in the expected location. Let me try again with the full path:"
  },
  {
   "t": 2.204,
   "type": "tool.call",
   "tool": "bash",
   "script": "probe_video",
   "args": {
    "command": "python tools/probe_video.py --video /home/video-code-harness/video-agent-harness-phase0/data/working/videos/mmKggCnGtA4.mp4"
   }
  },
  {
   "t": 2.336,
   "type": "tool.result",
   "tool": "bash",
   "script": "probe_video",
   "ok": true,
   "detail": "{\n  \"path\": \"/home/video-code-harness/video-agent-harness-phase0/data/working/videos/mmKggCnGtA4.mp4\",\n  \"duration_sec\": 120.419,\n  \"fps\": 23.976,\n  \"width\": 640,\n  \"height\": 272,\n  \"codec\": \"h264\",\n  \"nb_frames\": 2885,\n  \"has_audio_stream\": true,\n  \"size_bytes\": 7133204\n}"
  },
  {
   "t": 3.432,
   "type": "step.begin"
  },
  {
   "t": 3.432,
   "type": "agent.say",
   "text": "Great! Now I know the video is about 2 minutes long. Let me prepare a coarse scene-aware scan of the whole video:"
  },
  {
   "t": 3.432,
   "type": "tool.call",
   "tool": "bash",
   "script": "crv_prepare",
   "args": {
    "command": "python tools/crv_prepare.py --video /home/video-code-harness/video-agent-harness-phase0/data/working/videos/mmKggCnGtA4.mp4 --output artifacts_crv --why \"coarse overview of the entire video to identify main activities\""
   }
  },
  {
   "t": 9.109,
   "type": "tool.result",
   "tool": "bash",
   "script": "crv_prepare",
   "ok": true,
   "detail": "{\n  \"video\": \"/home/video-code-harness/video-agent-harness-phase0/data/working/videos/mmKggCnGtA4.mp4\",\n  \"output_dir\": \"artifacts_crv\",\n  \"duration_sec\": 120.419,\n  \"frames_extracted\": 16,\n  \"frame_budget_reserved\": 16,\n  \"timestamp_range\": [\n    0.0,\n    112.112\n  ],\n  \"grids\": [\n    \"grids/grid_01.jpg\",\n    \"grids/grid_02.jpg\"\n  ],\n  \"manifest\": \"artifacts_crv/MANIFEST.txt\",\n  \"budget\": {\n    \"limits\": {\n      \"coarse_frames\": 16,\n      \"dense_frames\": 16,\n      \"vlm_inspected_frames\": 32\n    },\n    \"spent\": {\n      \"coarse_frames\": 16,\n      \"dense_frames\": 0,\n      \"vlm_inspected_frames\": 0\n    },\n    \"remaining\": {\n      \"coarse_frames\": 0,\n      \"dense_frames\": 16,\n      \"vlm_inspected_frames\": 32\n    }\n  },\n  \"frames_index\": \"artifacts_crv/frames_index.json\",\n  \"note\": \"Per-frame timestamps are in frames_index.json; pass it to vlm_inspect.py.\"\n}"
  },
  {
   "t": 9.109,
   "type": "budget.spend",
   "script": "crv_prepare",